{
  "case_id": "FHP-SYNTH-001",
  "observation_id": "CAP-001",
  "source_ids": [
    "S2"
  ],
  "observation_window": {
    "date": "2026-07-15",
    "duration_minutes": 70
  },
  "output_achieved": "Completed one bounded document session.",
  "conditions": [
    "Reclined working position",
    "Single bounded session"
  ],
  "accommodations": [
    "Adaptive keyboard",
    "Reclined setup"
  ],
  "constraints": [
    "Increased symptoms after the session",
    "Most of the following day required for recovery"
  ],
  "recovery_cost": {
    "immediate": "Increased symptoms after the session.",
    "delayed": "Most of the next day was spent recovering."
  },
  "repeatability": "NOT_YET_KNOWN",
  "bounded_interpretation": "The session demonstrates a useful output under specific accommodations once; it does not establish sustainable work capacity or work readiness.",
  "prohibited_conclusions_withheld": [
    "Full-time capacity",
    "Work readiness",
    "Disability status",
    "Sustainable employment"
  ]
}
